{"status":"PASS","issues":[],"summary":"白胡椒粉的生成名称已修正，用量½茶匙仍完整保留在标签中。复核全部10项原料和16个步骤，单一来源配方、盐的分用、无油炒盐、焗制及余温静置、6份产量和计时控制均符合证据；重量近似差异及210分钟不覆盖过夜腌制的限制已披露。13项来源媒体文件均非空且哈希匹配，9张运行时步骤图映射正确，剩盐回收图未用作烹调步骤图。媒体更正同步审计记录与冻结证据一致。原料语义、步骤语法、标点和渲染结构检查通过，retry2确定性验证通过。","evidencePackageHash":"ce57a7bb25f28cf24cf541ff345b7c2e72fbdddb14212f6aef1e2902c3d80228","validatorPassed":true,"adversarialReview":{"ingredientSemantics":true,"stepGrammar":true,"punctuation":true,"renderedStructure":true}}
