{
  "status": "FAIL",
  "issues": [
    {
      "field": "generated.flags.containsBeef",
      "message": "配方明确使用约1000克牛柳，但生成记录的containsBeef为false，错误遗漏牛肉标记。应识别牛柳并生成containsBeef:true。"
    }
  ],
  "summary": "BBC整套配方、14项原料和22步保持来源一致，包裹冷却、两阶段温度、熟度分支、静置及150分钟和6份均准确；未知信息已披露。纯文字授权适用且无运行时图片引用，乳制品、鸡蛋、小麦、猪肉、含酒及非素食标记合理。全部原料行和步骤的对抗语言与结构审查通过，确定性验证通过；但牛肉标记错误，需修复后复审。",
  "evidencePackageHash": "b56221437c0469a54c081fb351c834d6050b2b4d58f7ef5dd894bd081bb6eba2",
  "validatorPassed": true,
  "adversarialReview": {
    "ingredientSemantics": true,
    "stepGrammar": true,
    "punctuation": true,
    "renderedStructure": true
  }
}
