{"status":"PASS","issues":[],"summary":"cn-039复审通过。实际图像确认第十八步对应料理机研磨，第十九步对应油锅煎炒，第二十步保持纯文字，前次两处错配已修复。其余已查看的本地图片本次哈希均与冻结证据一致，全部20张运行时过程图及成品图使用本地资源。重新核对31行原料、27个步骤、三款酱汁及二选一煮饭路线，无外部配方混入、虚构单位容量、固定范围计时或无依据火力。来源同页油量、蒜量及总时间差异均有原文依据并明确披露，未造成关键工艺缺失。四项独立语言检查及更新后的确定性、浏览器和构建校验通过。","evidencePackageHash":"63db4fafee7338deb0b1ac63cbc013168a98b58935b40dbab94aaf7d8d624898","validatorPassed":true,"adversarialReview":{"ingredientSemantics":true,"stepGrammar":true,"punctuation":true,"renderedStructure":true}}
